{"schema_version":"1.0","snapshot_id":"snapshot-001","tenant_id":"tenant-hctm","world_run_id":"world-run-genesis-001","branch_id":"main","through_sequence":1,"sim_time":"2026-07-08T10:15:00+08:00","rules_version":"rules-0.1.0","state_hash":"sha256:1111111111111111111111111111111111111111111111111111111111111111","state":{"equipment":{"LAS-WLD-02":{"condition":"degraded"}}},"created_at":"2026-07-22T04:00:01Z"}
